Title,Summary,Time
4ωρη στάση εργασίας την Τετάρτη σε όλα τα ΜΜΕ," Τα Διοικητικά Συμβούλια των Συνεργαζόμενων Ενώσεων στο χώρο του Τύπου και των ΜΜΕ αποφάσισαν να στηρίξουν τις πρωτοβουλίες των Εργατικών Κέντρων και Ομοσπονδιών σ’ όλη τη χώρα (ΓΣΕΕ – ΑΔΕΔΥ), με 4ωρη στάση...","15.06.2021, 16:42"
Για τον δημοκρατικό δρόμο - ξανά," Το περιβόητο εργασιακό νομοσχέδιο που κατεβάζει η κυβέρνηση στη Βουλή, αλλά και οι αντιπολιτευτικοί και συνδικαλιστικοί αγώνες ενάντια σε αυτό, αποκαλύπτουν μεταξύ άλλων μια αλήθεια της σύγχρονης ιστορίας. Οι...","15.06.2021, 16:00"
"Ο Χατζηδάκης, οι εργατοπατέρες, οι εργοδότες"," Bροντοφώναξε, απευθυνόμενος στο αντίπαλο «ακροατήριο» της Βουλής, ο φιλελεύθερος υπουργός Εργασίας Κωστής Χατζηδάκης, χωρίς ντροπή και με μεγάλη ασέβεια προς την ελληνική ιστορία: «Εσείς είστε με τους...","15.06.2021, 16:00"
"Αλλαγές στα ΜΜΜ για την αυριανή απεργία, ένεκα πανελλαδικών"," Κατά τη συζήτηση στο Μονομελές Πρωτοδικείο της προσφυγής Κεραμέως, εκπρόσωποι της ΑΔΕΔΥ επιβεβαίωσαν ότι τροποποιούνται και οι κινητοποιήσεις στις αστικές συγκοινωνίες.","15.06.2021, 15:04"
Live η συζήτηση του νόμου-οδοστρωτήρα για τα εργασιακά στην Ολομέλεια ," Σφοδρά πυρά κατά της κυβέρνησης εξαπολύουν για δεύτερη μέρα οι βουλευτές σύσσωμης της αντιπολίτευσης, για πρώτη φορά σε ένα κοινό μέτωπο τη διετία Μητσοτάκη, κατά τη συζήτηση του εκτρωματικού νομοσχεδίου στην...","15.06.2021, 13:26"
Ν.Δ.: Ανακοίνωση-μνημείο κυνισμού ενάντια στην αυριανή απεργία," Απίστευτος ο κυνισμός της κυβέρνησης που επικρίνει την αυριανή απεργία, μιλά για «βασανιστήρια» πολιτών και καλεί μάλιστα τον ΣΥΡΙΖΑ και το ΚΚΕ να τοποθετηθούν απέναντι.","15.06.2021, 09:22"
Επιστροφή του ΝΑΤΟ στις... ρίζες του - Ψυχρός πόλεμος στις δαπάνες, Ψυχρός πόλεμος στις δαπάνες / Μετωπική σύγκρουση για το εργασιακό ν/σ / Noor One: Εισαγγελέας καλεί Μαρινάκη και συνεργάτες / Οι Propatria στα χνάρια της Χρυσής Αυγής / Τρίτη και φαρμακερή δίωξη για τον Δ....,"15.06.2021, 07:39"
Ανήσυχη η ΕΕΔΑ για το εργασιακό νομοσχέδιο," Αν και επί της αρχής η κύρωση της Διεθνούς Σύμβασης Εργασίας 190 για τη βία και την παρενόχληση στην εργασία αποτιμάται θετικά από την Εθνική Επιτροπή για τα Δικαιώματα του Ανθρώπου, το κείμενο που...","15.06.2021, 06:00"
Στα χαρακώματα για τον εργασιακό μεσαίωνα," Μύδροι από ΣΥΡΙΖΑ, ΚΙΝ.ΑΛΛ., ΚΚΕ, ΜέΡΑ25, Ελληνική Λύση, για κυβερνητική εμμονή σε αποτυχημένες νεοφιλελεύθερες συνταγές τύπου Θάτσερ και για προκλητική εξυπηρέτηση των συμφερόντων της εργοδοσίας.","15.06.2021, 06:00"
Ανήσυχη η Εθνική Επιτροπή για τα Δικαιώματα του Ανθρώπου για το εργασιακό νομοσχέδιο," Η Εθνική Επιτροπή εντοπίζει ασάφειες, παραλείψεις και αντιφάσεις και υπογραμμίζει ότι δεν καλύπτονται όλοι οι τομείς στους οποίους παρέχεται εργασία.","14.06.2021, 22:26"
Τσίπρας: Δεν θα αφήσουμε σε χλωρό κλαρί τον κ. Μητσοτάκη και την κυβέρνησή του, Ο πρόεδρος του ΣΥΡΙΖΑ μίλησε για γραμμάτιο σε αυτούς που στήριξαν τον κ. Μητσοτάκη και επανέλαβε ότι μια προοδευτική κυβέρνηση θα ανατρέψει το αντεργατικο ν/σ.,"14.06.2021, 20:55"
Ζεσταίνουν τις μηχανές τους τα συνδικάτα , Με 24ωρη απεργία απαντά στο αντεργατικό νομοσχέδιο Χατζηδάκη η ΑΔΕΔΥ. Στάση εργασίας αποφάσισαν ΓΣΕΕ και ΕΚΑ.,"14.06.2021, 16:12"
Γυναικεία γονιμότητα: οδηγίες χρήσης," Το θρησκευτικό και ιατρικό ιερατείο, εκπροσωπούμενα από άνδρες που θεωρούν ότι αυτονοήτως φέρουν τη σχετική δικαιοδοσία, αποφάσισαν να συνεδριάσουν για τη γυναικεία γονιμότητα.","14.06.2021, 16:00"
Είμαστε απέναντι," Εργασιακό νομοσχέδιο που ελαστικοποιεί το ωράριο, παραπέμποντας το 8ωρο στην άνιση ατομική διαπραγμάτευση μεταξύ εργοδότη και εργαζόμενου.","14.06.2021, 16:00"
Γεννηματά: Η κυβέρνηση στηρίζει μόνο τα μεγάλα ιδιωτικά συμφέροντα, Κατά την επίσκεψή της στην ΕΑΒ η πρόεδρος του Κινήματος Αλλαγής κατηγόρησε εκ νέου την κυβέρνηση πώς με το εργασιακό νομοσχέδιο εξυπηρετεί τα μεγάλα ιδιωτικά συμφέροντα.,"14.06.2021, 15:37"
"«Με ρεπά, δεν γίνονται παιδιά»", Το σύνθημα το «αλιεύσαμε» από τα social media και είναι πραγματικότητα πως με λίγες λέξεις περιγράφει εύστοχα τις δικαιολογημένες αντιδράσεις που προκάλεσε το αναχρονιστικό συνέδριο γονιμότητας που τελικά...,"14.06.2021, 14:30"
Νέα απεργία - 16 Ιουνίου - από τα ναυτεργατικά σωματεία," Αναμένεται η στάση που θα κρατήσουν αυτή τη φορά οι ακτοπλόοι (ΣΕΕΝ) και εάν θα προσφύγουν στη δικαιοσύνη όπως έκαναν και στις προηγούμενες απεργιακές κινητοποιήσεις, ζητώντας να κηρυχτούν «παράνομες και...","14.06.2021, 13:05"
Ν. Φίλης για συνέδριο γονιμότητας και εργασιακό ν/σ Χατζηδάκη, Σκληρή κριτική στο νομοσχέδιο Χατζηδάκη για τα εργασιακά που συζητείται στη βουλή εξαπέλυσε ο τομεάρχης Παιδείας του ΣΥΡΙΖΑ-Π.Σ. Νίκος Φίλης.,"14.06.2021, 12:29"
ΑΔΕΔΥ: 24ωρη απεργία στις 16 Ιουνίου ," Η Εκτελεστική Επιτροπή της ΑΔΕΔΥ, αφού έλαβε υπόψη της τις προτάσεις-αποφάσεις ομοσπονδιών και νομαρχιακών τμημάτων, μετατρέπει τη στάση εργασίας της 16ης Ιουνίου σε 24ωρη απεργία την ίδια μέρα, αντιδρώντας...","14.06.2021, 11:14"
Στην Ολομέλεια η μεγάλη αναμέτρηση για την εργασία [LIVE] , Στη Βουλή το εργασιακό νομοσχέδιο που φέρει τη σφραγίδα του Κωστή Χατζηδάκη και έχει δικαίως χαρακτηριστεί «έκτρωμα».,"14.06.2021, 09:37"
"Γραβάτες, ιεράρχες, Ομογένεια, τουρισμός και υπογεννητικότητα ", Πριν ακόμα ξεκινήσει έχει ουσιαστικά αν όχι και τυπικά τιναχτεί στον αέρα το φιλόδοξο «1ο Πανελλήνιο Συνέδριο Γονιμότητας και Αναπαραγωγικής Αυτονομίας: Ορια και Επιλογές».,"14.06.2021, 08:40"
Ακονίζουν τα ξίφη τους στο ΚΙΝ.ΑΛΛ., Για μία εβδομάδα κοινοβουλευτικών μαχών και σύγκρουσης με την κυβέρνηση με επίκεντρο το νομοσχέδιο για τα εργασιακά που ψηφίζεται στην Ολομέλεια την Τετάρτη προετοιμάζονται στο Κίνημα Αλλαγής.,"14.06.2021, 06:30"
Νέα απεργία από τους ναυτεργάτες στις 16 Ιουνίου," Αποφασισμένοι να συνεχίσουν τις κινητοποιήσεις τους διατρανώνοντας την αντίθεσή τους στο εργασιακό νομοσχέδιο εμφανίζονται οι ναυτεργάτες, παρά τις δυο προσφυγές στη Δικαιοσύνη που κατέθεσαν κατά των δυο...","14.06.2021, 06:00"
Σε θέση μάχης για τα εργασιακά, Θέσεις μάχης παίρνει από σήμερα στη Βουλή ο ΣΥΡΙΖΑ - Π.Σ. εν όψει της συζήτησης στην Ολομέλεια του εργασιακού νομοσχεδίου της κυβέρνησης.,"14.06.2021, 06:00"
Ξεκινάει στη Βουλή η μάχη για το αντεργατικό νομοσχέδιο," Κατά της επιστροφής σε εργασιακό μεσαίωνα, σύσσωμη η αντιπολίτευση • Σοβαρές ενστάσεις διατυπώνει η Επιστημονική Υπηρεσία της Βουλής.","13.06.2021, 23:02"
"Εξωστρέφεια και οργανώσεις βάσης παντού, το επόμενο βήμα για το ΜέΡΑ25"," Την ανάγκη καλύτερης οργάνωσης των αποδήμων του ΜέΡΑ25, ίδρυσης και δημιουργίας νέων οργανώσεων βάσης παντού, καθώς και μεγαλύτερης εξωστρέφειας του κόμματος επισήμανε ο επικεφαλής του, Γιάνης Βαρουφάκης.","13.06.2021, 21:53"
Μαύρη τρύπα στα σχολεία με τα τεράστια κενά εκπαιδευτικών," Από το 2010 οι συνολικές αποχωρήσεις των εκπαιδευτικών από όλη την εκπαίδευση ξεπερνούν κατά πολύ τις 46.000, ενώ μέσα στην τελευταία πενταετία οι προσλήψεις αναπληρωτών αυξήθηκαν κατά 156%.","13.06.2021, 17:35"
Τα συνδικάτα απέδειξαν ότι παραμένουν όρθια, Το εργασιακό νομοσχέδιο στο «εδώλιο». Ηχηρό «όχι» από κοινωνία και αντιπολίτευση. Οι πολιτικοί αρχηγοί μιλούν στην «Εφ.Συν.»,"13.06.2021, 14:01"
Να ξεσκονίσω τον θρόνο σου;," Για να τελειώνουμε και μάλιστα εξαρχής: οι «δολοφόνοι» είμαστε εμείς. Μήτε οι τράπεζες μήτε οι κυβερνήσεις μήτε ο κακός θεούλης που μας μισεί. Εμείς. Αυτά, για να τελειώνουμε και μάλιστα εξαρχής.","13.06.2021, 11:00"
Ηλιόπουλος: Με εντολή Μητσοτάκη η φίμωση Τσίπρα στη Βουλή," Για «βαθύτατα φοβισμένη κυβέρνηση» κάνει λόγο ο εκπρόσωπος του ΣΥΡΙΖΑ-ΠΣ, τονίζοντας ότι ο πρωθυπουργός ενοχλήθηκε από το θέμα της ερώτησης του Αλέξη Τσίπρα, που ήταν τα δάνεια των κομμάτων.","12.06.2021, 19:27"
Ο δρόμος δίνει ώθηση στον ΣΥΡΙΖΑ," Οι επιθέσεις του Αλέξη Τσίπρα στον Κυριάκο Μητσοτάκη έχουν ενταθεί το τελευταίο διάστημα. Ολο και πιο συχνά ο αρχηγός της αξιωματικής αντιπολίτευσης βάζει στο κάδρο των ευθυνών τον πρωθυπουργό, κατηγορώντας...","12.06.2021, 16:10"
Ουραγοί στην ποιότητα απασχόλησης," Η Ελλάδα έχει τη χειρότερη επίδοση ως προς την ποιότητα της απασχόλησης στην Ε.Ε. και γι' αυτό σημαντικός παράγοντας αναδεικνύεται ο εβδομαδιαίος χρόνος εργασίας, τον οποίο τώρα επιχειρεί να παρατείνει η...","12.06.2021, 14:05"
Η σύγκρουση δύο κόσμων," Αν συγκρίνει κανείς όσα λένε τα κυβερνητικά στελέχη στους βολικούς μονολόγους τους σε πρόθυμα μέσα ενημέρωσης, τα οποία πρόσφεραν βήμα ακόμη και την...","12.06.2021, 09:15"
Ηχηρό «Όχι» από κοινωνία και αντιπολίτευση στο εργασιακό νομοσχέδιο," Το Θέμα της «Εφ.Συν.»: Το νομοσχέδιο-οδοστρωτήρας της Ν.Δ. και η απάντηση των εργαζομένων • Διεθνή: Τι γυρεύει ο Μπάιντεν από Ευρωπαίους και Τούρκους • Συνεντεύξεις: Γιάννα Αγγελοπούλου - Δασκαλάκη, Τάκης...","12.06.2021, 08:09"
«Οχι» από την Ενωση Δικαστών και Εισαγγελέων στο νέο εργασιακό νομοσχέδιο, Την αντίθεσή της στο νέο εργασιακό νομοσχέδιο εκφράζει η Ενωση Δικαστών και Εισαγγελέων με μια σημαντική παρέμβαση με την οποία τονίζει ότι πρόκειται για «σημαντική θεσμική οπισθοδρόμηση και θα διευρύνει την...,"12.06.2021, 06:00"
Το ΚΚΕ χαιρετίζει την απεργιακή κινητοποίηση και καλεί σε νέες μάχες," Σε κλιμάκωση του αγώνα για «να πεταχτεί στα σκουπίδια» το εργασιακό νομοσχέδιο Χατζηδάκη, καλεί το ΚΚΕ, με νέες, πιο μαζικές απεργιακές μάχες και συγκεντρώσεις.","11.06.2021, 13:20"
Κυρανάκης: Θα μπορείτε τώρα να δουλεύετε υπερωρίες για να πάτε στον γιατρό," Αδιανόητα επιχειρήματα για ακόμη μια φορά από τον βουλευτή της Ν.Δ., ο οποίος είτε αγνοεί πλήρως τα ισχύοντα εργασιακά δικαιώματα ή αδιαφορεί παντελώς για αυτά.","11.06.2021, 13:10"
Συλλαλητήρια και στην Κρήτη - Μαζικό ΟΧΙ στο νέο εργασιακό νομοσχέδιο," Με μεγάλη συμμετοχή και με βασικό αίτημα την απόσυρση του νέου εργασιακού νομοσχεδίου του Υπουργείου Εργασίας, πραγματοποιήθηκαν την Πέμπτη τα συλλαλητήρια στην Κρήτη στο πλαίσιο της 24ωρης απεργίας της 10ης...","11.06.2021, 09:41"
Στο Πειθαρχικό στέλνει η ΕΣΗΕΑ τους απεργοσπάστες του ΣΚΑΪ," Tον Γενικό Διευθυντή Ενημέρωσης του ΣΚΑΪ, Βασίλη Παπαδρόσο, και τον δημοσιογράφο, Νίκο Υποφάντη, παραπέμπει η ΕΣΗΕΑ και ζητά τη διερεύνηση τυχόν άλλων υπευθύνων","11.06.2021, 07:50"
Ο εργασιακός χρόνος ως αφαίρεση," Η τάση της εκμετάλλευσης των εργαζομένων ανά τους χρόνους αμβλύνθηκε μέσα από τις συλλογικές διεκδικήσεις των οργανώσεών τους και μέσα από τους, συχνά αιματηρούς, αγώνες τους.","11.06.2021, 06:30"
Η αρχαία πολιτική και το νομοσχέδιο, Το νομοσχέδιο για την εργασία αντί να βελτιώνει επιδεινώνει σχεδόν θανάσιμα το εργασιακό πλαίσιο και στην ουσία το σμπαραλιάζει.,"11.06.2021, 06:30"
Με μια φωνή: «Κάτω τα χέρια από το 8ωρο»," Εργαζόμενοι, φοιτητές, συνταξιούχοι, ιδιωτικοί και δημόσιοι υπάλληλοι βγήκαν στους δρόμους για να διαδηλώσουν την αντίθεσή τους στο εργασιακό νομοσχέδιο που προωθεί η κυβέρνηση και ο υπουργός Εργασίας, Κωστής...","11.06.2021, 06:23"
To αντεργατικό έκτρωμα Χατζηδάκη στο στόχαστρο κοινωνίας και αντιπολίτευσης," Συντονισμένη απεργιακή αντίδραση, πλημμυρίδα συλλαλητηρίων σε όλη τη χώρα / Οι «αόρατες» διατάξεις του νομοσχεδίου / Υγειονομικός εργασιακός μεσαίωνας / Πρύτανης πρόθυμος για όλα","10.06.2021, 05:20"
Η αντεργατική... κουρελού του Χατζηδάκη," Πλήθος δυσμενών διατάξεων καταργούν εργασιακά δικαιώματα, μειώνουν τις απολαβές και διευκολύνουν τις απολύσεις με το νέο αντεργατικό νομοσχέδιο.","10.06.2021, 05:15"
«Αντιμεταρρύθμιση του αιώνα», Σχεδόν ούτε έναν υπερασπιστή δεν βρήκε το εργασιακό νομοσχέδιο Χατζηδάκη στη χθεσινή «φαστ τρακ» ακρόαση των φορέων στην αρμόδια επιτροπή της Βουλής....,"10.06.2021, 05:15"
"Εμβολιαστείτε, αλλιώς απολύεστε", Η κυβέρνηση επιστρατεύει ευθέως την απειλή της εργοδοτικής αυθαιρεσίας και τρομοκρατίας για τους εργαζόμενους που δεν επιθυμούν να εμβολιαστούν κατά του κορονοϊού.,"10.06.2021, 05:15"
Η efsyn.gr συμμετέχει στην 24ωρη απεργία, Η ιστοσελίδα μας δεν θα μεταδίδει ειδήσεις από τις 05.30 της Πέμπτης έως τις 05.30 της Παρασκευής συμμετέχοντας στην απεργία που κήρυξε η ΕΣΗΕΑ.,"10.06.2021, 00:33"
Η ΚΟΕ για την απεργία ενάντια στο νέο εργασιακό νομοσχέδιο," «Απλήρωτες υπερωρίες, δουλειά τις Κυριακές, ωράρια και εργαζόμενοι λάστιχο. Απελευθέρωση απολύσεων και εργοδοτική αυθαιρεσία. Υποβάθμιση των δημόσιων ελεγκτικών μηχανισμών. Απαξίωση του συνδικαλισμού ως μέσου...","10.06.2021, 00:27"
"Τέλος Ιουνίου, λένε τώρα, οι εμβολιασμοί κατ' οίκον- Ανοίγουν 420.000 νέα ραντεβού ", Ο υπουργός είπε ότι ο εμβολιασμός των κατάκοιτων πολιτών θα γίνει με τη συμμετοχή ιδιωτών γιατρών και με το μονοδοσικό εμβόλιο της Johnson & Johnson.,"09.06.2021, 20:41"
ΣΥΡΙΖΑ: Δεσμευόμαστε ότι θα καταργηθεί το ν/σ Χατζηδάκη, «Τηλεπωλητή απλήρωτων 10ώρων» χαρακτήρισε τον υπουργό Εργασίας ο Ν. Ηλιόπουλος. «Ανοίγετε τον ασκό του Αιόλου» προειδοποίησε στη Βουλή ο Π. Σκουρλέτης.,"09.06.2021, 19:38"
Εργασιακό νομοσχέδιο: Σφυροκόπημα στη Βουλή από τους φορείς , Ακρόαση φορέων περιλαμβάνει η δεύτερη μέρα συζήτησης του αντεργατικού νομοσχεδίου Χατζηδάκη. Το νομοσχέδιο που εισάγεται την άλλη εβδομάδα στην ολομέλεια της Βουλής φιλοδοξεί να ξηλώσει και τα τελευταία...,"09.06.2021, 18:18"
Διαφοροποίηση του Οικονομικού Επιμελητηρίου για το αντεργατικό νομοσχέδιο , Ο πρόεδρος του Οικονομικού Επιμελητηρίου Ελλάδας Κωνσταντίνος Κόλλιας ζήτησε την ανάκληση της διάταξης για τη διευθέτηση του χρόνου εργασίας με ατομικές συμβάσεις και την κατάργηση της διάταξης για υπερωρίες...,"09.06.2021, 16:36"
"Αποδομούν τις εργασιακές σχέσεις, επιβάλλουν εργασιακό μεσαίωνα"," Ποιος ο λόγος να θελήσουν οι νέες και οι νέοι μας να εργαστούν σ’ ένα περιβάλλον που προάγει την εξουθενωτική και απλήρωτη εργασία με μειωμένες αποδοχές; Χαμένοι και οι άνεργοι, διότι το νομοσχέδιο ουσιαστικά...","09.06.2021, 16:00"
Εσάς τι σας νοιάζει;, Μας νοιάζει γιατί το Δημόσιο δεν είναι πια ο «ασφαλής εργασιακός τόπος» με τις καλές εργασιακές σχέσεις και τους υψηλούς μισθούς. Μας νοιάζει γιατί το νομοσχέδιο καθιστά το δικαίωμα συνδικαλιστικής δράσης...,"09.06.2021, 16:00"
Ο τουρισμός κατάπιε την αυτάρκεια," Το πολιτικό σύστημα, προσφέροντας «χάντρες και καθρεφτάκια» στους πολλούς, εξασφάλισε την ολοκληρωτική εξάρτηση του τόπου από τους προμηθευτές του τουριστικού «φορτίου» και από τους κατόχους του χρέους.","09.06.2021, 16:00"
Ενοχλεί τη Ν.Δ. η απλή αναλογική στα σωματεία συνταξιούχων," Για κάποια στελέχη της Νέας Δημοκρατίας δεν αρκεί η κατάργηση του εκλογικού συστήματος της απλής αναλογικής από την Τοπική Αυτοδιοίκηση με τον νόμο Βορίδη. Θέλουν να την ξηλώσουν από παντού, ακόμη και από τα...","09.06.2021, 14:35"
Βουλή: Πυρά ΓΣΕΒΕΕ-ΕΚΑ κατά του εργασιακού εκτρώματος Χατζηδάκη," Συντονισμένα πυρά από ΓΣΕΒΕΕ και ΕΚΑ κατά του νομοσχεδίου Χατζηδάκη, με αιχμή τις συλλογικές συμβάσεις εργασίας, τις υπερωρίες, αλλά και το δικαίωμα στην απεργία.","09.06.2021, 13:19"
ΠΑΜΕ: Το αντεργατικό νομοσχέδιο να πεταχτεί στα σκουπίδια, Με κεντρικό σύνθημα «το αντεργατικό νομοσχέδιο να πεταχτεί στα σκουπίδια» το Πανεργατικό Αγωνιστικό Μέτωπο καλεί στο μαζικό συλλαλητήριο ενάντια στο αντεργατικό νομοσχέδιο.,"09.06.2021, 11:42"
