Title,Summary,Time
Live η συζήτηση για το αντεργατικό νομοσχέδιο στις επιτροπές της Βουλής," Στη σκιά της χθεσινής προκλητικής εμφάνισης του υπουργού Εργασίας, αλλά και με το βλέμμα στην αυριανή μεγάλη απεργία συνεχίζεται η συζήτηση για το νομοθετικό έκτρωμα Χατζηδάκη στις επιτροπές της Βουλής.","09.06.2021, 10:23"
Πρώτη «μάχη» για το αντεργατικό νομοσχέδιο," Στο πόδι όλη η χώρα αύριο ενάντια στο αντεργατικό νομοσχέδιο Χατζηδάκη που, σύμφωνα με τον σχεδιασμό της κυβέρνησης, έρχεται προς ψήφιση την επόμενη εβδομάδα.","09.06.2021, 09:28"
Ομοβροντία κατά του «Χατζηθάφτη» της εργασίας, Αντιμέτωπος με ένα διακομματικό τσουνάμι αντιδράσεων απέναντι στο εργασιακό νομοσχέδιο με άρωμα Μεσαίωνα ήρθε χθες στη Βουλή ο υπουργός Εργασίας Κωστής Χατζηδάκης.,"09.06.2021, 06:00"
«Η Ν.Δ. διαλύει το εργατικό δίκαιο», Με επίσκεψη στα ΕΛΤΑ στο Κρυονέρι και συζήτηση με τους εργαζόμενους η Φώφη Γεννηματά έδωσε το στίγμα των θέσεων του ΚΙΝ.ΑΛΛ. ενόψει της αυριανής απεργίας όπου θα δώσει το «παρών».,"09.06.2021, 06:00"
Μαστίγιο και καρότο για τον πλήρη εμβολιασμό," Σε «νέο εμβολιαστικό κύμα» κάλεσε χθες από τη Βουλή ο Κυριάκος Μητσοτάκης, καθώς φαίνεται να διαψεύδονται από τους δείκτες της περιόδου οι προβλέψεις της κυβέρνησης για «τείχος ανοσίας» στην αρχή του...","09.06.2021, 06:00"
Συνάντηση Τσίπρα με ΑΔΕΔΥ," Ο πρόεδρος του ΣΥΡΙΖΑ έκανε λόγο για «ευθεία επίθεση στις εργασιακές σχέσεις με την κατάργηση του 8ωρου», ενώ έβαλε στο τραπέζι και άλλα ζητήματα, όπως ο συνδικαλιστικός νόμος, ο νόμος για τα ΑΕΙ, η συρρίκνωση...","09.06.2021, 06:00"
Πρώτες εσωκομματικές αναταράξεις για το εργασιακό νομοσχέδιο , Τις πρώτες εσωκομματικές ενστάσεις στο αντεργατικό νομοσχέδιο Χατζηδάκη μετρά η Νέα Δημοκρατία.,"08.06.2021, 20:33"
«Η κυβέρνηση μας επιστρέφει στην εποχή των ατομικών συμβάσεων»," Ο πρωθυπουργός πληρώνει όλα τα γραμμάτια των ανακοινώσεων που έκανε στις Γ.Σ. του ΣΕΒ, είπε η Φώφη Γεννηματά, η οποία άσκησε κριτική στο εργασιακό νομοσχέδιο που άρχισε να συζητείται στη Βουλή.","08.06.2021, 16:25"
"Πού πήγε το πάθος για την αλήθεια, συνάδελφοι;"," Για τον υπουργό του οποίου η επαγγελματική καριέρα εξελίχτηκε μόνο μέσα σε κομματικό πυρήνα, δεν χρειάζεται και πολύ ερώτημα για να εξηγήσουμε με πόση ευκολία λέει ανερυθρίαστα ψέματα, όταν επαναλαμβάνει ότι η...","08.06.2021, 16:00"
Χωρίς τρένα την Πέμπτη λόγω απεργίας για το εργασιακό ν/σ," Τη συμμετοχή της στην 24ωρη γενική απεργία της Πέμπτης ανακοίνωσαν οι εργαζόμενοι του ΟΣΕ, με αποτέλεσμα να υπάρξουν ματαιώσεις δρομολογίων αύριο και μεθαύριο.","08.06.2021, 15:43"
Δεμένα πλοία και λουκέτο στα εμπορικά λιμάνια στις 10 Ιουνίου," Δεμένα θα μείνουν τα πλοία στα λιμάνια της χώρας την Πέμπτη 10 Ιουνίου, καθώς 13 ναυτεργατικά σωματεία πραγματοποιούν 24ωρη πανελλαδική απεργία σε όλες τις κατηγορίες των πλοίων. «Λουκέτο» και στα εμπορικά...","08.06.2021, 14:43"
Αλ. Τσίπρας: Η κυβέρνηση θέλει να καταλύσει το δημοκρατικό και κοινωνικό κεκτημένο της Μεταπολίτευσης, Για ευθεία επίθεση στις εργασιακές σχέσεις κατηγόρησε την κυβέρνηση ο πρόεδρος του ΣΥΡΙΖΑ-Π.Σ. κατά τη συνάντησή του με την Εκτελεστική Επιτροπή της ΑΔΕΔΥ.,"08.06.2021, 14:00"
Επικεφαλής η Φώφη στη συγκέντρωση, Αγώνας ουσίας αλλά και ισχυρών συμβολισμών είναι για το Κίνημα Αλλαγής ο επικείμενος γύρω από τα εργασιακά.,"08.06.2021, 11:31"
Κινητοποιήσεις και στην Κρήτη ενάντια στο εργασιακό νομοσχέδιο," Στις απεργιακές κινητοποιήσεις της Πέμπτης 10 Ιουνίου θα συμμετέχουν σωματεία, οργανώσεις και κόμματα της Κρήτης, με αφορμή την ψήφιση του νέου εργασιακού νομοσχεδίου του Υπουργείου Εργασίας.","08.06.2021, 09:30"
Απολύσεις στο Ταμείο Αλληλοβοήθειας του ΥΠΠΟΑ!," Ο Ενιαίος Σύλλογος Υπαλλήλων ΥΠΠΟ Αττικής, Στερεάς και Νήσων καταγγέλλει ότι οι λόγοι της απόλυσης είναι «εκδικητικοί» καθώς αφορούν 7 από τους 35 εργαζομένους που είχαν προσφύγει στο ΣτΕ.","08.06.2021, 06:00"
Ο «Βυσσινόκηπος» στα χρόνια του ανάλγητου νεοφιλελευθερισμού, Με βάση το κλασικό έργο του Τσέχοφ «Ο Βυσσινόκηπος» ο Πρόδρομος Τσινικόρης υφαίνει τη συνέχεια της ιστορίας και την τοποθετεί στο σήμερα.,"07.06.2021, 22:36"
Κ. Νοτοπούλου-Ρέθυμνο: Να στηριχθεί ο τουριστικός κλάδος και οι εργαζόμενοι," Με εκπροσώπους εργαζομένων στον τουρισμό, φορείς, δημάρχους και εκπροσώπους της τοπικής αυτοδιοίκησης, συναντήθηκε η τομεάρχης Τουρισμού του ΣΥΡΙΖΑ Κατερίνα Νοτοπούλου, με στόχο να ενημερωθεί για τα προβλήματα...","07.06.2021, 20:38"
Μοντέλο ΕΦΚΑ για τον ΕΟΠΥΥ," Mοντέλο EΦΚΑ σε ό,τι αφορά την εκχώρηση υπηρεσιών σε ιδιώτες, αλλά για ποσά πολύ μεγαλύτερα από αυτά που μπορεί να ζητήσει ένας λογιστής ή ένας δικηγόρος για την έκδοση μιας καθυστερημένης σύνταξης, φαίνεται...","07.06.2021, 17:26"
Σφοδρές αντιδράσεις για τις απολύσεις στο Ταμείο Αλληλοβοήθειας του ΥΠΠΟ," Oι λόγοι της απόλυσης των 7 εργαζομένων είναι «ξεκάθαρα εκδικητικοί», τονίζει ο Ενιαίος Σύλλογος Υπαλλήλων ΥΠΠΟ Αττικής, ενώ ο ΣΥΡΙΖΑ-ΠΣ κάνει λόγο για «τις πρώτες απολύσεις που πραγματοποιούνται στο δημόσιο...","07.06.2021, 16:23"
Πρωτοφανής «συνδικαλισμός» στην Alpha Bank με αφορμή τον εμβολιασμό κατά της Covid, Με επιστολή τους στη διεύθυνση οι συνδικαλιστές της Alpha Bank ζητούν να τεθούν σε υποχρεωτική άδεια όσοι δεν εμβολιάζονται «ώστε να ωριμάσει η σκέψη τους για την αποδοχή του εμβολιασμού».,"07.06.2021, 12:50"
ΜέΡΑ25: Ο Υπουργός Εργοδοσίας στοχοποιεί τον κόσμο της εργασίας," Πυρών συνέχεια κατά της κυβέρνησης της Ν.Δ. και ειδικά κατά του υπουργού Εργασίας Κωστή Χατζηδάκη, από το ΜέΡΑ25, με αφορμή το εργασιακό νομοσχέδιο.","06.06.2021, 20:57"
Της Αριστεράς...," H κυβέρνηση έχει φέρει τα πάνω κάτω στην ελληνική επικράτεια, οδεύει σταθερά στον αυταρχισμό και στην αποδιάρθρωση της κοινωνίας με τα νομοθετήματά της, που διαλύουν τον εργασιακό ιστό, και η αντιπολίτευση,...","06.06.2021, 11:28"
"Η πάλη των τάξεων, ως κλάσμα"," Nομίζω ότι ο καλύτερος τρόπος για να καταλάβει κανείς το ταξικό βάθος του νομοσχεδίου Χατζηδάκη, την απέχθεια, ενδεχομένως και το μίσος για την εργασία, είναι να κάνουμε μια νοητή μετάβαση στην –προς το παρόν–...","06.06.2021, 11:07"
Επί ποδός για το εργασιακό «έκτρωμα» Χατζηδάκη," Ορόσημο στη μάχη που καλούνται να δώσουν οι εργαζόμενοι ενάντια στο σχέδιο νόμου που καταστρατηγεί τα δικαιώματά τους, η απεργία της 10ης Ιουνίου.","05.06.2021, 12:38"
Νέο πλήγμα στο δικαίωμα της απεργίας, Καυτό δωδεκαήμερο πολιτικής και απεργιακής έντασης με επίκεντρο το Εργασιακό/Συγκρούσεις ανηλίκων: Τα αγριεμένα παιδιά της πόλης/Προανακριτική: Τι θα λέει στο υπόμνημά του ο Νίκος Παππάς.,"05.06.2021, 08:32"
Το δημογραφικό και το εργασιακό," Η επίλυση του δημογραφικού προβλήματος είναι από την πρώτη στιγμή το θέμα πολύ ψηλά στην ατζέντα της κυβέρνησης, είπε η υφυπουργός Εργασίας. Προς στιγμή ένιωσα ότι ζω σε άλλη χώρα, π.χ. στη Σουηδία.","04.06.2021, 16:00"
Η ΟΤΟΕ εκθέτει τα ψέματα του υπουργού Εργασίας," Μέχρι και την τελευταία στιγμή ο υπουργός Εργασίας συνεχίζει να υπεραμύνεται της διάταξής του για υπέρβαση του 8ωρου και διευθέτηση του χρόνου εργασίας με ατομική σύμβαση και όχι με συλλογική, όπως ήδη ισχύει.","04.06.2021, 13:24"
Υποχώρηση μετά την κατακραυγή, Διαβάστε στην «Εφ.Συν.»: Ντόμινο εξελίξεων από το χθεσινό δημοσίευμα της «Εφ.Συν.» • Κατατίθεται το εργασιακό νομοσχέδιο • Ώρα μηδέν για τη φορολόγηση των πολυεθνικών στη σύνοδο του G7,"04.06.2021, 08:00"
Πρόγευση έντασης στο λιμάνι," Εν μέσω καταγγελιών για «ενορχηστρωμένη επίθεση από κυβέρνηση - υπουργείο - εφοπλιστές», η ΠΕΝΕΝ μετέτρεψε την εξαγγελθείσα 24ωρη απεργία σε στάση εργασίας. Στη συνέχεια τα πλοία απέπλευσαν κανονικά.","04.06.2021, 06:00"
Ζήτησαν απόσυρση του νομοσχεδίου Χατζηδάκη και προστασία του 8ώρου, Με το βλέμμα στη γενική απεργία της 10ης Ιουνίου πραγματοποιήθηκαν συλλαλητήρια στην Αθήνα και στη Θεσσαλονίκη κατά του εργασιακού νομοσχεδίου που προωθεί η κυβέρνηση.,"03.06.2021, 19:45"
Σύγκρουση Ξενογιαννακοπούλου με υπ. Εργασίας για τα ρεπό αντί υπερωριών, Για διαστρέβλωση των διατάξεων του νομοσχεδίου και ψέματα για το θέμα των ρεπό αντί πληρωμής των υπερωριών κατηγορεί τον ΣΥΡΙΖΑ-ΠΣ το υπ. Εργασίας. Πραπληροφόρηση και διαστρέβλωση της πραγματικότητας...,"03.06.2021, 19:15"
Χρηστίδης: Ο εργαζόμενος μένει απροστάτευτος με υπογραφή της Ν.Δ.," «Με το εργασιακό νομοσχέδιο η κυβέρνηση απορυθμίζει τις εργασιακές σχέσεις, ισοπεδώνει τα εργασιακά δικαιώματα, υπονομεύει πλήρως τις συλλογικές συμβάσεις, ενισχύει μόνο τους ασύδοτους εργοδότες» τόνισε ο...","03.06.2021, 16:52"
Εν μέσω καταγγελιών ανέστειλε η ΠΕΝΕΝ την 24ωρη απεργία ," Οι ναυτεργάτες πραγματοποίησαν στάση εργασίας μέχρι τις 9 το πρωί. Έτσι κανονικά πραγματοποιούνται τα ακτοπλοϊκά δρομολόγια από το λιμάνι του Πειραιά, ενώ προβλήματα δημιουργήθηκαν μόνο για τα πρωινά...","03.06.2021, 12:15"
Ανεστάλη η απεργία της ΠΕΝΕΝ - Κανονικά τα δρομολόγια των πλοίων," H Πανελλήνια Ενωση Ναυτών Εμπορικού Ναυτικού προχώρησε σε μετατροπή της 24ωρης απεργίας σε στάση εργασίας, διαμαρτυρόμενη ενάντια στο εργασιακό ν/σ","03.06.2021, 08:35"
Παράνομη έκρινε το δικαστήριο την απεργία των ναυτεργατών - Αμετακίνητη η ΠΕΝΕΝ, Το σωματείο καλεί όλους τους ναυτεργάτες να δώσουν αγωνιστικό παρόν στο κάλεσμα της στις 5 το πρωί στο λιμάνι του Πειραιά απέναντι από τον Ηλεκτρικό Σταθμό.,"02.06.2021, 21:23"
Η κατάργηση της προστασίας από τις απολύσεις στο εργασιακό νομοσχέδιο," Στο εργασιακό νομοσχέδιο υπάρχουν διατάξεις που δεν έχουν λάβει τη δέουσα προσοχή σε μια δημοκρατική διαδικασία διαλόγου, με χαρακτηριστικότερες όλων...","02.06.2021, 14:40"
"Διακυβέρνηση Μητσοτάκη, Ανεξάρτητες Αρχές, κομματικοποίηση του κράτους"," H κυβέρνηση επί δύο χρόνια επιδίδεται σε μία διαρκή και απροκάλυπτη προσπάθεια υποβάθμισης, ελέγχου και χειραγώγησης των Ανεξάρτητων Αρχών.","02.06.2021, 14:23"
ΓΣΕΕ: Κυβέρνηση και υπουργείο «νίπτουν τα χείρας τους» για την εργασιακή δυστοπία," Για στοχευμένες νομικές κατασκευές και επικίνδυνες ιδεολογικές ακροβασίες κάνει λόγο το ανώτατο συνδικαλιστικό όργανο των εργαζομένων, ανακοινώνοντας επίσημα την απεργία της 10ης Ιουνίου.","02.06.2021, 14:02"
Κρήτη: Σε κινητοποιήσεις οι εκπαιδευτικοί ενάντια στο εργασιακό νομοσχέδιο, Κάλεσμα συμμετοχής στις κινητοποιήσεις που διοργανώνονται ενάντια στο νομοσχέδιο της κυβέρνησης για τα εργασιακά απευθύνει με ανακοίνωση της ΕΛΜΕ Χανίων καθώς και σύλλογοι εκπαιδευτικών του Ηρακλείου.,"02.06.2021, 09:34"
ΠΑΜΕ: Δε θα επικυρώσουμε τον διαλυτικό τους σχεδιασμό," «Oι εργαζόμενοι και τα σωματεία τους, να προσπεράσουν την ηγεσία της ΓΣΕΕ που βρίσκεται σε διατεταγμένη υπηρεσία στη διάθεση της κυβέρνησης και των εργοδοτικών ενώσεων» σημειώνει το Πανεργατικό Αγωνιστικό...","01.06.2021, 10:23"
Εκθετοι Μητσοτάκης - Χρυσοχοΐδης μπροστά στην έξαρση της εγκληματικότητας," λλού το έγκλημα, αλλού η αστυνομία / Ενα πολιτικό «ναυάγιο» ύψους 750.000 ευρώ/ Ελληνοτουρκικά: Εδωσαν ραντεβού για τις 14 Ιουνίου / Συντονισμένη απεργιακή αντίδραση στις 10 Ιουνίου / Οι Γερμανοί ξανάρχονται...","01.06.2021, 07:30"
Η επιστολή των 41 Εργατικών Κέντρων κατά της ελάχιστης βάσης εισαγωγής στα ΑΕΙ," Κοινό μέτωπο υπέρ της ισότιμης παιδείας, από την ΟΙΕΛΕ και 41 Εργατικά Κέντρα, που με επιστολή τους ζητούν από την Πρόεδρο της Δημοκρατίας Κατερίνα Σακελλαροπούλου, να μην εφαρμοστεί ο «κόφτης».","31.05.2021, 20:49"
Με κοινό βηματισμό οι απεργίες των ΓΣΕΕ και ΑΔΕΔΥ," Απέναντι στο εργασιακό νομοσχέδιο που προωθεί η κυβέρνηση, ΓΣΕΕ και ΑΔΕΔΥ ενώνουν τις φωνές τους, καθώς θα πραγματοποιήσουν απεργιακές κινητοποιήσεις την ίδια ημέρα, δηλαδή στις 10 Ιουνίου. ","31.05.2021, 20:03"
Χημικά και ξύλο έξω από το Υπουργείο Εργασίας," Σε μια συμβολική κίνηση, οι οικοδόμοι έριξαν τσιμέντο στην είσοδο του Υπουργείο Εργασίας, με τις αστυνομικές δυνάμεις να απαντούν με χρήση χημικών. ","31.05.2021, 19:11"
Αλ. Τσίπρας: Η κυβέρνηση έχει κηρύξει τον πόλεμο στον κόσμο της εργασίας, Περιοδειών συνέχεια για τον πρόεδρο του ΣΥΡΙΖΑ-Π.Σ. Αλέξη Τσίπρα ο οποίος επισκέπτεται τη Χαλκίδα με πρώτο σταθμό την Ένωση Εργαζομένων της ΛΑΡΚΟ. Σφοδρή επίθεση στην κυβέρνηση Μητσοτάκη για την πολιτική της...,"31.05.2021, 14:02"
Μέτωπο της εργασίας υπέρ ισότιμης παιδείας, «Από φέτος αρχίζει να λειτουργεί ο «κόφτης» της Ελάχιστης Βάσης Εισαγωγής στην τριτοβάθμια εκπαίδευση που θα αφήσει εκτός Πανεπιστημίου τουλάχιστον 20-25 χιλιάδες μαθητές.,"31.05.2021, 13:46"
Ζήτησε αλλαγή πόστου με γνωμάτευση γιατρού και τον απέλυσαν," Σε μια καταγγελία που θα συζητηθεί προχωρά το Εργατοϋπαλληλικό Κέντρο Ελευσίνας – Δυτικής Αττικής. Σύμφωνα με το ΕΚΕ-ΔΑ εταιρεία, που δραστηριοποιείται στον Ασπρόπυργο, «έστειλε 4μηνη προειδοποίηση απόλυσης»...","31.05.2021, 11:19"
Στη Χαλκίδα ο Αλέξης Τσίπρας, Θα μιλήσει με καταστηματάρχες και πολίτες και θα βρεθεί στο πλευρό των εργαζομένων της ΛΑΡΚΟ ● Μαζί του και ο Συμεών Κεδίκογλου.,"31.05.2021, 09:39"
Μια αναγκαία συνάντηση Παιδείας και εργασίας," Δεκάδες τμήματα ΑΕΙ και ΤΕΙ απειλούνται με κλείσιμο ελλείψει φοιτητών, με ποικίλες παρενέργειες στις τοπικές κοινωνίες.","31.05.2021, 09:10"
Κίνηση επιστημόνων υπέρ των εργατικών κεκτημένων," «Πρωτοβουλία για την Υπεράσπιση της Εργασίας» ονομάζουν δεκάδες ιστορικοί, κοινωνιολόγοι, οικονομολόγοι, πολιτικοί επιστήμονες, ανθρωπολόγοι της εργασίας και ερευνητές τη σειρά δράσεων που αναλαμβάνουν για την...","31.05.2021, 06:00"
«Δεν συμβαίνουν πλέον ιστορίες», Ο Πρόδρομος Τσινικόρης με την παράσταση «(Somewhere) beyond the cherry trees» ανοίγει το φετινό Φεστιβάλ Αθηνών και μιλά στην «Εφ.Συν.» για τη τέχνη και το θέατρο.,"30.05.2021, 18:12"
ΚΚΕ: Για το εργασιακό έκτρωμα Χατζηδάκη φταίει και η Ε.Ε.!," Δεν είναι η πρώτη φορά που στο στόχαστρο της κριτικής του ΚΚΕ μπαίνει η Ε.Ε. Μπορεί να παίρνει μέρος στις ευρωεκλογές και να βγάζει και ευρωβουλευτές, ωστόσο το Κόμμα έχει σαφή θέση και αυτή είναι ενάντια στην...","30.05.2021, 06:00"
Ν. Φίλης: Άρχισαν τα όργανα για την κυβέρνηση...," «Γιατί χρειάστηκε ορυμαγδός κυβερνητικών δηλώσεων για να απαντήσουν στο πρωτοσέλιδο δημοσίευμα της εφημερίδας ΤΑ ΝΕΑ, σύμφωνα με το οποίο παγώνει η ίδρυση της Πανεπιστημιακής Αστυνομίας ''για να εξασφαλιστεί η...","28.05.2021, 17:19"
Μαζικά καλέσματα για συμμετοχή στην 24ωρη απεργία κατά του αντεργατικού νομοσχεδίου," Δυναμική αντίδραση στο νομοσχέδιο του υπουργείου Εργασίας, που θέτει στο στόχαστρο βασικά εργασιακά δικαιώματα, όπως το 8ωρο, το δικαίωμα στην απεργία, αλλά και η συνδικαλιστική εκπροσώπηση των εργαζομένων,...","28.05.2021, 15:44"
"Αλ. Τσίπρας: Θρασύδειλος, αμετανόητος και δημαγωγός ο Κ. Μητσοτάκης", Με πολύ επιθετικό ύφος η απάντηση Τσίπρα στη χθεσινή ομιλία Μητσοτάκη και στην άρνησή του να απαντήσει για τη μείωση χιλιάδων εισακτέων στα ΑΕΙ,"28.05.2021, 10:50"
Διαλύουν την Επιθεώρηση Εργασίας, Τη σκόπιμη υποβάθμιση των ελεγκτικών μηχανισμών από την κυβέρνηση επισήμανε ο Αλέξης Τσίπρας στη χτεσινή συνάντηση με τους εργαζομένους του υπουργείου Εργασίας και τους επιθεωρητές του ΣΕΠΕ.,"28.05.2021, 06:00"
Τσίπρας: Συνειδητή κυβερνητική επιλογή η υποβάθμιση της επιθεώρησης εργασίας, Αλ. Τσίπρας: έντονη ανησυχία για τις προθέσεις της κυβέρνησης με το νέο εργασιακό νομοσχέδιο και για την υποβάθμιση του έργου του ΣΕΠΕ.,"27.05.2021, 14:33"
